{"accepted_facts":[{"fact_id":"F-001","source_refs":["fixture/bounded-software-work.json"],"text":"The normalizer is local and bounded."},{"fact_id":"F-001","source_refs":["fixture/bounded-software-work.json"],"text":"Only the owner may adopt a repair proposal."},{"fact_id":"F-001","source_refs":["fixture/bounded-software-work.json"],"text":"Acceptance requires an independent validator result."},{"fact_id":"G1-O-001","source_refs":["generations/G1/return.json","phase5a/workspace/profile_loader.py"],"text":"V-001 is explained by inline-hash truncation in profile_loader.py; the available local evidence does not indicate a separate value-normalization cause."},{"fact_id":"G2-G2-O-001","source_refs":["generations/G2/return.json","phase5a/workspace/profile_loader.py"],"text":"The observed loss of the inline hash is localized to the unconditional split at # in normalize_profile; the existing quoted-value stripping remains separate and applicable."},{"fact_id":"G2-G2-O-002","source_refs":["generations/G2/return.json","phase5a/workspace/policy.json"],"text":"The local policy resolves U-001 in favor of retaining an inline # as data, so the current implementation conflicts with policy before independent validation can pass."}],"active_blockers":["initial-validation-failure"],"active_hypothesis":{"basis_refs":["phase5a/workspace/policy.json","phase5a/workspace/profile_loader.py","phase5a/workspace/validator-report.json"],"hypothesis_id":"H-001","statement":"The initial validation failure is caused by unconditional inline-hash truncation in profile_loader.py, while the existing quoted-value normalization remains applicable.","status":"active"},"budget_remaining":4,"checkpoint":"research","current_result":{"acceptance_evidence":false,"failure_id":"V-001","independent":false,"status":"FAIL","validator":"workspace/validator-report.json"},"evidence_refs":["workspace/validator-report.json"],"handoff_id":"HO-G3-001","invalidated_hypotheses":[],"latest_valid_commit":{"commit_id":"COM-0002","source_ref":"source/immutable-r2.json","state_revision":2},"operation_history":[],"prohibited_routes":["do not split a value at # without policy evidence","do not treat a worker Return or summary as acceptance evidence","do not execute a repair without owner adoption","do not reuse an invalidated hypothesis"],"repair_history":[],"retrieval_pointers":[{"pointer_id":"RET-RESEARCH","purpose":"bounded primary-source research if local evidence cannot resolve the question","ref":"https://docs.python.org/3.12/library/configparser.html"},{"pointer_id":"RET-VALIDATOR","purpose":"independent final acceptance validation","ref":"workspace/independent-validator.py"}],"schema":"fpo.phase5a.handoff-package.v1","state_source_ref":"source/immutable-r2.json","summary_notes":"Local policy observation rejected the initial route; primary-source confirmation remains bounded.","uncertainties":[{"question":"Does the project policy treat an inline # as data or as a comment?","status":"resolved","uncertainty_id":"U-001"},{"question":"Is the current failure caused by parsing, value normalization, or both?","status":"open","uncertainty_id":"U-002"}],"work_control":{"acceptance_verdict":"UNKNOWN","approval_state":"granted","control_state":"running","lifecycle":"active"},"work_id":"FPO-5A-001","work_revision":"r2","workspace_refs":["workspace/profile_loader.py","workspace/policy.json","workspace/validator-report.json"]}
