{"accepted_facts":[{"fact_id":"F-001","source_refs":["fixture/bounded-software-work.json"],"text":"The normalizer is local and bounded."},{"fact_id":"F-001","source_refs":["fixture/bounded-software-work.json"],"text":"Only the owner may adopt a repair proposal."},{"fact_id":"F-001","source_refs":["fixture/bounded-software-work.json"],"text":"Acceptance requires an independent validator result."},{"fact_id":"G1-O-001","source_refs":["generations/G1/return.json","phase5a/workspace/profile_loader.py"],"text":"V-001 is explained by inline-hash truncation in profile_loader.py; the available local evidence does not indicate a separate value-normalization cause."},{"fact_id":"G2-G2-O-001","source_refs":["generations/G2/return.json","phase5a/workspace/profile_loader.py"],"text":"The observed loss of the inline hash is localized to the unconditional split at # in normalize_profile; the existing quoted-value stripping remains separate and applicable."},{"fact_id":"G2-G2-O-002","source_refs":["generations/G2/return.json","phase5a/workspace/policy.json"],"text":"The local policy resolves U-001 in favor of retaining an inline # as data, so the current implementation conflicts with policy before independent validation can pass."},{"fact_id":"G3-G3-O-001","source_refs":["generations/G3/return.json","https://docs.python.org/3.12/library/configparser.html"],"text":"The Python 3.12 configparser documentation states that inline comments are disabled by default, while # and ; are whole-line comment prefixes; it also warns that enabling inline comments prevents those characters from being used in values."},{"fact_id":"G3-G3-O-002","source_refs":["generations/G3/return.json","phase5a/workspace/profile_loader.py"],"text":"The bounded research supports narrowing U-002 to unconditional inline-hash truncation during parsing/normalization; no separate quoted-value normalization cause is indicated by the current local evidence."},{"fact_id":"G3-SOURCE-001","source_refs":["source/SRC-5A-G3-001.json"],"text":"In Python 3.12 configparser, inline_comment_prefixes defaults to None, so inline comments are disabled by default; # and ; remain whole-line comment prefixes, and enabling inline comments can prevent those characters from being used in values."},{"fact_id":"G4-G4-O-001","source_refs":["generations/G4/return.json","phase5a/workspace/profile_loader.py"],"text":"normalize_profile unconditionally applies line.split(\"#\", 1) before key/value parsing, which changes the fixture title from Alpha # tag to Alpha and directly matches V-001."},{"fact_id":"G4-G4-O-002","source_refs":["generations/G4/return.json","phase5a/workspace/policy.json"],"text":"The narrow repair boundary is the inline-hash truncation step; existing quoted-value stripping should remain unchanged."},{"fact_id":"G5-G5-O-001","source_refs":["generations/G5/return.json","workspace/validator-report-post-repair.json"],"text":"V-002 is a key canonicalization mismatch in the repaired projection: key.strip() preserves Title, while the independent validator expects the canonical key title; this is separate from the already addressed inline-hash truncation."}],"active_blockers":["post-repair-validation-failure"],"active_hypothesis":{"basis_refs":["workspace/repaired-001/profile_loader.py","workspace/validator-report-post-repair.json","workspace/independent-validator.py","workspace/policy.json"],"hypothesis_id":"H-002","statement":"V-002 is caused by missing key canonicalization; an owner-adopted narrow repair should lowercase the normalized key while preserving inline # data and the existing quoted-value normalization.","status":"active"},"budget_remaining":1,"checkpoint":"final_validation","current_result":{"acceptance_evidence":false,"failure_id":"V-002","independent":false,"status":"FAIL","validator":"workspace/validator-report-post-repair.json"},"evidence_refs":["workspace/validator-report.json","source/SRC-5A-G3-001.json"],"handoff_id":"HO-G6-001","invalidated_hypotheses":[{"hypothesis_id":"H-000","invalidated_at_generation":"G4","reason":"The initially plausible route of treating every inline # as a comment was rejected by local policy and source-bound research."}],"latest_valid_commit":{"commit_id":"COM-0005","source_ref":"source/immutable-r5.json","state_revision":5},"operation_history":["RO-5A-G4-001","REPAIR-5A-002"],"prohibited_routes":["do not split a value at # without policy evidence","do not treat a worker Return or summary as acceptance evidence","do not execute a repair without owner adoption","do not reuse an invalidated hypothesis"],"repair_history":[{"operation_id":"RO-5A-G4-001","status":"executed","target_ref":"phase5a/workspace/profile_loader.py"},{"operation_id":"REPAIR-5A-002","status":"adopted","target_ref":"phase5a/workspace/profile_loader.py"}],"retrieval_pointers":[{"pointer_id":"RET-RESEARCH","purpose":"bounded primary-source research if local evidence cannot resolve the question","ref":"https://docs.python.org/3.12/library/configparser.html"},{"pointer_id":"RET-VALIDATOR","purpose":"independent final acceptance validation","ref":"workspace/independent-validator.py"}],"schema":"fpo.phase5a.handoff-package.v1","state_source_ref":"source/immutable-r5.json","summary_notes":"The post-repair failure is current; the prior invalidated hypothesis remains rejected and an alternate repair awaits execution.","uncertainties":[{"question":"Does the project policy treat an inline # as data or as a comment?","status":"resolved","uncertainty_id":"U-001"},{"question":"Is the current failure caused by parsing, value normalization, or both?","status":"resolved","uncertainty_id":"U-002"}],"work_control":{"acceptance_verdict":"UNKNOWN","approval_state":"granted","control_state":"running","lifecycle":"active"},"work_id":"FPO-5A-001","work_revision":"r5","workspace_refs":["workspace/profile_loader.py","workspace/policy.json","workspace/validator-report.json","workspace/repaired-001/profile_loader.py"]}
