{"accepted_facts":[{"fact_id":"F-001","source_refs":["fixture/bounded-software-work.json"],"text":"The normalizer is local and bounded."},{"fact_id":"F-001","source_refs":["fixture/bounded-software-work.json"],"text":"Only the owner may adopt a repair proposal."},{"fact_id":"F-001","source_refs":["fixture/bounded-software-work.json"],"text":"Acceptance requires an independent validator result."}],"active_blockers":["initial-validation-failure"],"active_hypothesis":null,"budget_remaining":6,"checkpoint":"diagnosis","current_result":{"acceptance_evidence":false,"failure_id":"V-001","independent":false,"status":"FAIL","validator":"workspace/validator-report.json"},"evidence_refs":["workspace/validator-report.json"],"handoff_id":"HO-G1-001","invalidated_hypotheses":[],"latest_valid_commit":{"commit_id":"COM-0000","source_ref":"source/immutable-r0.json","state_revision":0},"operation_history":[],"prohibited_routes":["do not split a value at # without policy evidence","do not treat a worker Return or summary as acceptance evidence","do not execute a repair without owner adoption","do not reuse an invalidated hypothesis"],"repair_history":[],"retrieval_pointers":[{"pointer_id":"RET-LOCAL-POLICY","purpose":"read the local parsing policy","ref":"workspace/policy.json"},{"pointer_id":"RET-RESEARCH","purpose":"bounded primary-source research if local evidence cannot resolve the question","ref":"https://docs.python.org/3.12/library/configparser.html"},{"pointer_id":"RET-VALIDATOR","purpose":"independent final acceptance validation","ref":"workspace/independent-validator.py"}],"schema":"fpo.phase5a.handoff-package.v1","state_source_ref":"source/immutable-r0.json","summary_notes":"Initial bounded Work is unresolved; diagnose from persisted failure and uncertainty.","uncertainties":[{"question":"Does the project policy treat an inline # as data or as a comment?","status":"open","uncertainty_id":"U-001"},{"question":"Is the current failure caused by parsing, value normalization, or both?","status":"open","uncertainty_id":"U-002"}],"work_control":{"acceptance_verdict":"UNKNOWN","approval_state":"granted","control_state":"running","lifecycle":"active"},"work_id":"FPO-5A-001","work_revision":"r0","workspace_refs":["workspace/profile_loader.py","workspace/policy.json","workspace/validator-report.json"]}
